{
  "schema_version": 1,
  "name": "capability-embedded-parent-chain",
  "kind": "capability",
  "profile": "jcs-signing-payload-v1",
  "tags": [
    "capability-chain",
    "embedded-object",
    "nested-ordering"
  ],
  "document": {
    "@context": [
      "https://w3id.org/zcap/v1",
      "https://w3id.org/security/suites/ed25519-2020/v1"
    ],
    "id": "urn:uuid:cap-child-embedded-parent",
    "type": "Authorization",
    "controller": "did:key:z6MkpTHR8VNsBxYAAWHut2Geadd9jSwuBV8xRoAnwWsdvktH",
    "parentCapability": "urn:uuid:cap-parent",
    "invocationTarget": "https://resource.example/genomics/variant/17",
    "allowedAction": [
      "query_variant"
    ]
  },
  "proof": {
    "type": "Ed25519Signature2020",
    "created": "2026-03-05T00:00:00Z",
    "proofPurpose": "capabilityDelegation",
    "verificationMethod": "did:key:z6MkpTHR8VNsBxYAAWHut2Geadd9jSwuBV8xRoAnwWsdvktH#z6MkpTHR8VNsBxYAAWHut2Geadd9jSwuBV8xRoAnwWsdvktH",
    "capabilityChain": [
      {
        "@context": "https://w3id.org/zcap/v1",
        "id": "urn:uuid:cap-parent",
        "controller": "did:key:z6MkhaXgBZDvotDkL5257faiztiGiC2QtKLGpbnnEGta2doK",
        "invocationTarget": "https://resource.example/genomics/variant/17",
        "allowedAction": [
          "query_variant",
          "query_gene"
        ]
      }
    ]
  },
  "notes": "Embedded parent object in capabilityChain to stress nested object ordering and serialization."
}
