{
  "schema_version": 1,
  "name": "capability-empty-arrays-edge",
  "kind": "capability",
  "profile": "jcs-signing-payload-v1",
  "tags": [
    "edge",
    "absence-vs-empty",
    "model-defaults"
  ],
  "document": {
    "@context": [
      "https://w3id.org/zcap/v1",
      "https://w3id.org/security/suites/ed25519-2020/v1"
    ],
    "id": "urn:uuid:cap-empty-arrays",
    "type": "Authorization",
    "controller": "did:key:z6MkhaXgBZDvotDkL5257faiztiGiC2QtKLGpbnnEGta2doK",
    "parentCapability": "urn:zcap:root:https%3A%2F%2Fresource.example%2Fnotes",
    "invocationTarget": "https://resource.example/notes/42",
    "allowedAction": [],
    "caveat": []
  },
  "proof": {
    "type": "Ed25519Signature2020",
    "created": "2026-03-02T00:00:00Z",
    "proofPurpose": "capabilityDelegation",
    "verificationMethod": "did:key:z6MkhaXgBZDvotDkL5257faiztiGiC2QtKLGpbnnEGta2doK#z6MkhaXgBZDvotDkL5257faiztiGiC2QtKLGpbnnEGta2doK",
    "capabilityChain": []
  },
  "notes": "Intentionally edge-shaped fixture to expose absent-vs-empty-array behavior."
}
