{
  "schema_version": 1,
  "name": "capability-caveat-empty",
  "kind": "capability",
  "profile": "jcs-signing-payload-v1",
  "tags": [
    "caveat",
    "absence-vs-empty",
    "model-defaults"
  ],
  "document": {
    "@context": [
      "https://w3id.org/zcap/v1",
      "https://w3id.org/security/suites/ed25519-2020/v1"
    ],
    "id": "urn:uuid:cap-caveat-empty",
    "type": "Authorization",
    "controller": "did:key:z6MkhaXgBZDvotDkL5257faiztiGiC2QtKLGpbnnEGta2doK",
    "parentCapability": "urn:zcap:root:https%3A%2F%2Fresource.example%2Fcaveats",
    "invocationTarget": "https://resource.example/caveats/empty",
    "caveat": []
  },
  "proof": {
    "type": "Ed25519Signature2020",
    "created": "2026-03-09T00:00:01Z",
    "proofPurpose": "capabilityDelegation",
    "verificationMethod": "did:key:z6MkhaXgBZDvotDkL5257faiztiGiC2QtKLGpbnnEGta2doK#z6MkhaXgBZDvotDkL5257faiztiGiC2QtKLGpbnnEGta2doK",
    "capabilityChain": [
      "urn:zcap:root:https%3A%2F%2Fresource.example%2Fcaveats"
    ]
  },
  "notes": "Paired with capability-caveat-missing to isolate explicit empty array behavior for caveat."
}
