{
  "schema_version": 1,
  "name": "capability-explicit-nulls",
  "kind": "capability",
  "profile": "jcs-signing-payload-v1",
  "tags": [
    "null-handling",
    "edge",
    "spec-stress"
  ],
  "document": {
    "@context": [
      "https://w3id.org/zcap/v1",
      "https://w3id.org/security/suites/ed25519-2020/v1"
    ],
    "id": "urn:uuid:cap-explicit-nulls",
    "type": "Authorization",
    "controller": "did:key:z6MkhaXgBZDvotDkL5257faiztiGiC2QtKLGpbnnEGta2doK",
    "parentCapability": "urn:zcap:root:https%3A%2F%2Fresource.example%2Fnulls",
    "invocationTarget": "https://resource.example/nulls/1",
    "allowedAction": null,
    "expires": null,
    "caveat": null
  },
  "proof": {
    "type": "Ed25519Signature2020",
    "created": "2026-03-06T00:00:00Z",
    "proofPurpose": "capabilityDelegation",
    "verificationMethod": "did:key:z6MkhaXgBZDvotDkL5257faiztiGiC2QtKLGpbnnEGta2doK#z6MkhaXgBZDvotDkL5257faiztiGiC2QtKLGpbnnEGta2doK",
    "capabilityChain": null
  },
  "notes": "Explicit nulls should be omitted consistently if the implementation claims null-stripping behavior."
}
