{
  "schema_version": 1,
  "name": "capability-proof-field-whitelist",
  "kind": "capability",
  "profile": "jcs-signing-payload-v1",
  "tags": [
    "interop-core",
    "proof-field-whitelist"
  ],
  "document": {
    "@context": [
      "https://w3id.org/zcap/v1",
      "https://w3id.org/security/suites/ed25519-2020/v1"
    ],
    "id": "urn:uuid:cap-proof-field-whitelist",
    "type": "Authorization",
    "controller": "did:key:z6MkhaXgBZDvotDkL5257faiztiGiC2QtKLGpbnnEGta2doK",
    "parentCapability": "urn:uuid:cap-proof-field-whitelist-parent",
    "invocationTarget": "https://resource.example/proof-fields/records/123",
    "expires": "2027-01-01T00:00:00Z",
    "allowedAction": [
      "read"
    ],
    "caveat": [
      {
        "type": "UsageCount",
        "maxUses": 5
      }
    ]
  },
  "proof": {
    "type": "Ed25519Signature2020",
    "created": "2026-04-29T00:00:00Z",
    "proofPurpose": "capabilityDelegation",
    "verificationMethod": "did:key:z6MkhaXgBZDvotDkL5257faiztiGiC2QtKLGpbnnEGta2doK#z6MkhaXgBZDvotDkL5257faiztiGiC2QtKLGpbnnEGta2doK",
    "nonce": "abc123",
    "domain": "https://resource.example/proof-fields",
    "capabilityChain": [
      "urn:zcap:root:https%3A%2F%2Fresource.example%2Fproof-fields%2Frecords",
      "urn:uuid:cap-proof-field-whitelist-parent"
    ]
  },
  "notes": "Isolation fixture for the secondary divergence flagged in issue #1. The on-document proof carries non-whitelisted fields (nonce, domain) that the W3C 'proof minus proofValue' rule preserves verbatim while a hand-picked whitelist (e.g. zcap-dotnet's ProofSigningPayloadBuilder) silently drops. Surfaces the disagreement as a single-fixture failure when an adapter strips proof fields."
}
