{
  "schema_version": 1,
  "name": "capability-minimal",
  "kind": "capability",
  "profile": "jcs-signing-payload-v1",
  "tags": [
    "interop-core",
    "minimal",
    "absence"
  ],
  "document": {
    "@context": [
      "https://w3id.org/zcap/v1",
      "https://w3id.org/security/suites/ed25519-2020/v1"
    ],
    "id": "urn:uuid:cap-minimal",
    "type": "Authorization",
    "controller": "did:key:z6MkhaXgBZDvotDkL5257faiztiGiC2QtKLGpbnnEGta2doK",
    "parentCapability": "urn:zcap:root:https%3A%2F%2Fresource.example%2Frecords",
    "invocationTarget": "https://resource.example/records/123"
  },
  "proof": {
    "type": "Ed25519Signature2020",
    "created": "2026-01-01T00:00:00Z",
    "proofPurpose": "capabilityDelegation",
    "verificationMethod": "did:key:z6MkhaXgBZDvotDkL5257faiztiGiC2QtKLGpbnnEGta2doK#z6MkhaXgBZDvotDkL5257faiztiGiC2QtKLGpbnnEGta2doK",
    "capabilityChain": [
      "urn:zcap:root:https%3A%2F%2Fresource.example%2Frecords"
    ]
  },
  "notes": "Baseline delegated capability with optional fields absent."
}
