{
  "schema_version": 1,
  "name": "invocation-missing-capability-action-edge",
  "kind": "invocation",
  "profile": "jcs-signing-payload-v1",
  "tags": [
    "edge",
    "missing-field",
    "model-defaults"
  ],
  "document": {
    "id": "urn:uuid:inv-missing-action",
    "capability": "urn:uuid:cap-missing-action",
    "invocationTarget": "https://resource.example/missing-action"
  },
  "proof": {
    "type": "Ed25519Signature2020",
    "created": "2026-03-14T00:00:00Z",
    "proofPurpose": "capabilityInvocation",
    "verificationMethod": "did:key:z6MkhaXgBZDvotDkL5257faiztiGiC2QtKLGpbnnEGta2doK#z6MkhaXgBZDvotDkL5257faiztiGiC2QtKLGpbnnEGta2doK",
    "capability": "urn:uuid:cap-missing-action",
    "invocationTarget": "https://resource.example/missing-action",
    "capabilityChain": []
  },
  "notes": "Intentionally incomplete invocation to expose missing-field behavior versus silent defaulting."
}
