{
  "schema_version": 1,
  "name": "capability-allowed-action-empty",
  "kind": "capability",
  "profile": "jcs-signing-payload-v1",
  "tags": [
    "allowed-action",
    "absence-vs-empty",
    "model-defaults"
  ],
  "document": {
    "@context": [
      "https://w3id.org/zcap/v1",
      "https://w3id.org/security/suites/ed25519-2020/v1"
    ],
    "id": "urn:uuid:cap-allowed-action-empty",
    "type": "Authorization",
    "controller": "did:key:z6MkpTHR8VNsBxYAAWHut2Geadd9jSwuBV8xRoAnwWsdvktH",
    "parentCapability": "urn:zcap:root:https%3A%2F%2Fresource.example%2Fallowed-actions",
    "invocationTarget": "https://resource.example/allowed-actions/empty",
    "allowedAction": []
  },
  "proof": {
    "type": "Ed25519Signature2020",
    "created": "2026-03-08T00:00:01Z",
    "proofPurpose": "capabilityDelegation",
    "verificationMethod": "did:key:z6MkpTHR8VNsBxYAAWHut2Geadd9jSwuBV8xRoAnwWsdvktH#z6MkpTHR8VNsBxYAAWHut2Geadd9jSwuBV8xRoAnwWsdvktH",
    "capabilityChain": [
      "urn:zcap:root:https%3A%2F%2Fresource.example%2Fallowed-actions"
    ]
  },
  "notes": "Paired with capability-allowed-action-missing to isolate explicit empty array behavior for allowedAction."
}
